========== Initialization: Verify Cascade Topology ==========
db_p.check_until_timeout select count(*) from oceanbase.__all_virtual_server_stat where role = 'PRIMARY', 1, 30;
db_s1.check_until_timeout select count(*) from oceanbase.__all_virtual_server_stat where role = 'STANDBY', 1, 30;
db_s2.check_until_timeout select count(*) from oceanbase.__all_virtual_server_stat where role = 'STANDBY', 1, 30;
db_s2.check_until_timeout select count(*) from oceanbase.__all_virtual_server_stat where log_restore_source like '%:$db_s1_rpc_port', 1, 30;
Initialization completed: Cascade topology verified (db_p -> db_s1 -> db_s2)
========== Case 1: Verify Cascade Sync ==========
create table if not exists test_cascade_standby(id int primary key, name varchar(100), value int);
insert into test_cascade_standby values(1, 'init_data', 100);
insert into test_cascade_standby values(2, 'init_data_2', 200);
db_p.check_until_timeout select count(*) as cnt from oceanbase.dba_ob_rootservice_jobs where JOB_TYPE = "LOAD_MYSQL_SYS_PACKAGE" and JOB_STATUS = "SUCCESS" and RESULT_CODE = 0, 1, 120;
db_s1.check_until_timeout select count(*) from test_cascade_standby where id = 1, 1, 120;
db_s1.check_until_timeout select count(*) from test_cascade_standby where id = 2, 1, 30;
db_s2.check_until_timeout select count(*) from test_cascade_standby where id = 1, 1, 180;
db_s2.check_until_timeout select count(*) from test_cascade_standby where id = 2, 1, 60;
select count(*) from test_cascade_standby;
count(*)
2
create table standby_t1 (c1 int);
ERROR HY000: standby tenant is read only
call DBMS_AI_SERVICE.CREATE_AI_MODEL('ob_embed', '{"type": "dense_embedding","model_name": "text-embedding-v3"}');
ERROR HY000: standby tenant is read only
db_s1.check_until_timeout select count(*) as cnt from oceanbase.dba_ob_rootservice_jobs where JOB_TYPE = "LOAD_MYSQL_SYS_PACKAGE", 0, 10;
select count(*) from test_cascade_standby;
count(*)
2
create table standby_t1 (c1 int);
ERROR HY000: standby tenant is read only
call DBMS_AI_SERVICE.CREATE_AI_MODEL('ob_embed', '{"type": "dense_embedding","model_name": "text-embedding-v3"}');
ERROR HY000: standby tenant is read only
db_s2.check_until_timeout select count(*) as cnt from oceanbase.dba_ob_rootservice_jobs where JOB_TYPE = "LOAD_MYSQL_SYS_PACKAGE", 0, 10;
Case 1 completed: Cascade sync verified (db_p -> db_s1 -> db_s2)
========== Case 2: Switchover in Cascade Topology ==========
db_p.check_until_timeout select count(*) from oceanbase.__all_virtual_server_stat where log_restore_source like '%:$db_s2_rpc_port', 1, 30;
insert into test_cascade_standby values(3, 'before_switchover', 300);
db_s1.check_until_timeout select count(*) from test_cascade_standby where id = 3, 1, 120;
db_s2.check_until_timeout select count(*) from test_cascade_standby where id = 3, 1, 180;
db_s1.mysql alter system set debug_sync_timeout = '1000s';
db_s2.mysql alter system set debug_sync_timeout = '1000s';
db_s1.mysql set ob_global_debug_sync = 'BEFORE_STANDBY_LOG_SYNC_FETCH signal cascade_relay_paused wait_for cascade_relay_resume execute 1';
db_s2.mysql set ob_global_debug_sync = 'AFTER_STANDBY_PROMOTION_BOUNDARY_RESOLVED signal cascade_boundary_resolved execute 1';
db_s1.mysql set ob_global_debug_sync = 'now wait_for cascade_relay_paused';
update test_cascade_standby
set name = 'root_cutover_boundary', value = 301
where id = 3;
ALTER SYSTEM SWITCHOVER TO STANDBY;
db_p.check_until_timeout select count(*) from oceanbase.__all_virtual_server_stat where role = 'PRIMARY' and pending_role = 'STANDBY' and switchover_status = 'PREPARING', 1, 60;
db_p.check_until_timeout select count(*) as cnt from oceanbase.dba_ob_rootservice_jobs where JOB_TYPE = "LOAD_MYSQL_SYS_PACKAGE", 1, 10;
ALTER SYSTEM SWITCHOVER TO PRIMARY;
db_s2.mysql set ob_global_debug_sync = 'now wait_for cascade_boundary_resolved';
db_s2.check_until_timeout select count(*) from oceanbase.__all_virtual_server_stat where role = 'STANDBY' and pending_role = 'INVALID' and switchover_status = 'NORMAL', 1, 30;
db_s2.check_until_timeout select count(*) from test_cascade_standby where id = 3 and value = 300, 1, 30;
db_s1.mysql set ob_global_debug_sync = 'now signal cascade_relay_resume';
db_s2.check_until_timeout select count(*) from oceanbase.__all_virtual_server_stat where role = 'PRIMARY' and pending_role = 'INVALID' and switchover_status = 'NORMAL', 1, 120;
db_s2.check_until_timeout select count(*) from test_cascade_standby where id = 3 and name = 'root_cutover_boundary' and value = 301, 1, 120;
db_p.force_stop;
db_p.nstart;
db_p.check_until_timeout select count(*) from oceanbase.__all_virtual_server_stat where role = 'STANDBY' and pending_role = 'INVALID' and switchover_status = 'NORMAL', 1, 60;
db_s2.check_until_timeout select count(*) as cnt from oceanbase.dba_ob_rootservice_jobs where JOB_TYPE = "LOAD_MYSQL_SYS_PACKAGE" and JOB_STATUS = "SUCCESS" and RESULT_CODE = 0, 1, 120;
insert into test_cascade_standby values(4, 'after_switchover', 400);
db_p.check_until_timeout select count(*) from test_cascade_standby where id = 4, 1, 120;
db_s1.check_until_timeout select count(*) from test_cascade_standby where id = 4, 1, 180;
select count(*) from test_cascade_standby;
count(*)
4
create table standby_t1 (c1 int);
ERROR HY000: standby tenant is read only
call DBMS_AI_SERVICE.CREATE_AI_MODEL('ob_embed', '{"type": "dense_embedding","model_name": "text-embedding-v3"}');
ERROR HY000: standby tenant is read only
db_s1.check_until_timeout select count(*) as cnt from oceanbase.dba_ob_rootservice_jobs where JOB_TYPE = "LOAD_MYSQL_SYS_PACKAGE", 0, 10;
Case 2 completed: Deep cascade switchover used the original primary boundary
========== Case 3: Roundtrip Switchover in Cascade Topology ==========
db_s2.check_until_timeout select count(*) from oceanbase.__all_virtual_server_stat where log_restore_source like '%:$db_p_rpc_port', 1, 30;
insert into test_cascade_standby values(5, 'before_roundtrip', 500);
db_p.check_until_timeout select count(*) from test_cascade_standby where id = 5, 1, 120;
db_s1.check_until_timeout select count(*) from test_cascade_standby where id = 5, 1, 180;
ALTER SYSTEM SWITCHOVER TO STANDBY;
db_s2.check_until_timeout select count(*) from oceanbase.__all_virtual_server_stat where role = 'PRIMARY' and pending_role = 'STANDBY' and switchover_status = 'PREPARING', 1, 60;
ALTER SYSTEM SWITCHOVER TO PRIMARY;
db_p.check_until_timeout select count(*) from oceanbase.__all_virtual_server_stat where role = 'PRIMARY' and pending_role = 'INVALID' and switchover_status = 'NORMAL', 1, 120;
db_s2.force_stop;
db_s2.nstart;
db_s2.check_until_timeout select count(*) from oceanbase.__all_virtual_server_stat where role = 'STANDBY' and pending_role = 'INVALID' and switchover_status = 'NORMAL', 1, 60;
db_s2.check_until_timeout select count(*) from oceanbase.__all_virtual_server_stat where log_restore_source like '%:$db_s1_rpc_port', 1, 30;
insert into test_cascade_standby values(6, 'after_roundtrip', 600);
db_s1.check_until_timeout select count(*) from test_cascade_standby where id = 6, 1, 120;
db_s2.check_until_timeout select count(*) from test_cascade_standby where id = 6, 1, 180;
select count(*) from test_cascade_standby;
count(*)
6
select count(*) from test_cascade_standby;
count(*)
6
select count(*) from test_cascade_standby;
count(*)
6
Case 3 completed: Roundtrip switchover in cascade topology verified
========== Case 4: Failover in Cascade Topology ==========
db_s1.check_until_timeout select count(*) from test_cascade_standby where id = 7, 1, 120;
db_s2.check_until_timeout select count(*) from test_cascade_standby where id = 7, 1, 180;
db_p.force_stop;
ALTER SYSTEM ACTIVATE STANDBY;
db_s1.check_until_timeout select count(*) from oceanbase.__all_virtual_server_stat where role = 'PRIMARY' and pending_role = 'INVALID' and switchover_status = 'NORMAL', 1, 60;
insert into test_cascade_standby values(8, 'after_failover', 800);
db_s2.check_until_timeout select count(*) from test_cascade_standby where id = 8, 1, 180;
select count(*) from test_cascade_standby;
count(*)
8
Case 4 completed: Failover in cascade topology verified
========== Case 5: Dynamic log_restore_source Change ==========
db_s2.check_until_timeout select count(*) from oceanbase.__all_virtual_server_stat where log_restore_source = '', 1, 30;
select count(*) from test_cascade_standby where id = 9;
count(*)
0
Step 2-3 completed: Empty log_restore_source stops sync (db_s2 cannot get id=9)
db_s2.check_until_timeout select count(*) from oceanbase.__all_virtual_server_stat where log_restore_source like '%:$db_s1_rpc_port', 1, 30;
db_s2.check_until_timeout select count(*) from test_cascade_standby where id = 9, 1, 120;
select count(*) from test_cascade_standby;
count(*)
9
Case 5 completed: Dynamic log_restore_source change verified (empty stops sync, new upstream resumes)
========== Test Summary ==========
All cascade standby test cases completed successfully:
1. Cascade sync verification (db_p -> db_s1 -> db_s2): PASSED
2. Switchover in cascade topology: PASSED
3. Roundtrip switchover in cascade topology: PASSED
4. Failover in cascade topology: PASSED
5. Dynamic log_restore_source change (empty + new upstream): PASSED
Cascade standby topology verified successfully
